Buchungstag;Wertstellung;Umsatzart;Buchungstext;Betrag;Währung;Auftraggeberkonto;Bankleitzahl Auftraggeberkonto;IBAN Auftraggeberkonto;Kategorie
16.04.2018;16.04.2018;Lastschrift;"Telefonica Germany GmbH + Co. OHG Kd-Nr.:6035343202,Rg-Nr.:1763624500 /5,Mehr Infos unter:Ihre Mobilfunkr echnung. End-to-End-Ref.: 3600553123300001763624500005RCUR Mandatsref: T0010001B000006035343202 Gläubiger-ID: DE9700000000142462 SEPA-BASISLASTSCHRIFT wiederholend";-34,57;EUR;401383500;36540046;DE90365400460401383500;Unkategorisierte Ausgaben
11.04.2018;11.04.2018;Gutschrift;"Marcela Prax Von Berenthal Rechn.-Nr.: 20180318032 End-to-End-Ref.: NOTPROVIDED Kundenreferenz: NSCT1804110006930000000000000000001";297,50;EUR;401383500;36540046;DE90365400460401383500;Einnahmen
11.04.2018;11.04.2018;Gutschrift;"Marcela Prax Von Berenthal Rechn.-Nr.: 20180418031 End-to-End-Ref.: NOTPROVIDED Kundenreferenz: NSCT1804110006930000000000000000001";357,00;EUR;401383500;36540046;DE90365400460401383500;Einnahmen
10.04.2018;10.04.2018;Gutschrift;"MARTIN LEMMER Rechnungs Nr. 20180314011 Gruss Mar tin End-to-End-Ref.: NOTPROVIDED Kundenreferenz: NSCT1804100001000000000000000000001";600,95;EUR;401383500;36540046;DE90365400460401383500;Einnahmen
09.04.2018;09.04.2018;Lastschrift;"PayPal (Europe) S.a.r.l. et Cie., S .C.A. PP.8082.PP . PAYPAL, Ihr Einkauf be i PAYPAL End-to-End-Ref.: 1002867403906 PP.8082.PP PAYPAL Mandatsref: 5LH2224TE66Y2 Gläubiger-ID: LU96ZZZ0000000000000000058 SEPA-BASISLASTSCHRIFT wiederholend";-25,22;EUR;401383500;36540046;DE90365400460401383500;Unkategorisierte Ausgaben
06.04.2018;06.04.2018;Lastschrift;"Telefonica Germany GmbH + Co. OHG Kd-Nr.:6043589287,Rg-Nr.:1760037398 /5,Mehr Infos unter:Ihr Handy Raten plan. End-to-End-Ref.: 3500552331530001760037398005RCUR Mandatsref: T0010001B000006043589287 Gläubiger-ID: DE9700000000142462 SEPA-BASISLASTSCHRIFT wiederholend";-21,00;EUR;401383500;36540046;DE90365400460401383500;Unkategorisierte Ausgaben
